{"schema":1,"system":{"os":"linux","version":"6.8","arch":"x86_64","wsl":false,"apple_silicon":false},"cpu":{"vendor":"amd","model":"fixture","physical_cores":16,"logical_cores":32},"memory":{"system_ram_gib":64,"unified_memory_gib":0},"accelerators":[{"id":"0","type":"gpu","vendor":"nvidia","name":"fixture CUDA","runtime":"cuda","architecture":"compute_8.9","driver":"fixture","memory_gib":24,"unified_memory":false,"apis":["cuda","vulkan"]}],"backend_targets":{"mlx":{"device":"unsupported"},"gguf":{"device":"cuda"},"audio":{"device":"cuda"},"vllm":{"device":"cuda"}}}
