{"schema":1,"system":{"os":"macos","version":"26.0","arch":"arm64","wsl":false,"apple_silicon":true},"cpu":{"vendor":"apple","model":"Apple M4","physical_cores":10,"logical_cores":10},"memory":{"system_ram_gib":24,"unified_memory_gib":24},"accelerators":[{"id":"0","type":"gpu","vendor":"apple","name":"Apple M4","runtime":"metal","architecture":"10-core","driver":"26.0","memory_gib":24,"unified_memory":true,"apis":["metal"]}],"backend_targets":{"mlx":{"device":"metal"},"gguf":{"device":"metal"},"audio":{"device":"metal"},"vllm":{"device":"metal"}}}
