{"schema":1,"system":{"os":"linux","version":"6.8","arch":"x86_64","wsl":false,"apple_silicon":false},"cpu":{"vendor":"intel","model":"fixture","physical_cores":16,"logical_cores":32},"memory":{"system_ram_gib":64,"unified_memory_gib":0},"accelerators":[{"id":"0","type":"gpu","vendor":"intel","name":"fixture XPU","runtime":"xpu","architecture":"pvc","driver":"fixture","memory_gib":48,"unified_memory":false,"apis":["xpu","sycl","level-zero","vulkan"]}],"backend_targets":{"mlx":{"device":"unsupported"},"gguf":{"device":"sycl"},"audio":{"device":"vulkan"},"vllm":{"device":"xpu"}}}
