{"schema":1,"system":{"os":"linux","version":"6.8","arch":"x86_64","wsl":false,"apple_silicon":false},"cpu":{"vendor":"intel","model":"fixture","physical_cores":16,"logical_cores":32},"memory":{"system_ram_gib":64,"unified_memory_gib":0},"accelerators":[{"id":"0","type":"tpu","vendor":"google","name":"fixture TPU v6e","runtime":"tpu","architecture":"v6e","driver":"fixture","memory_gib":0,"unified_memory":false,"apis":["jax","xla"]}],"backend_targets":{"mlx":{"device":"unsupported"},"gguf":{"device":"cpu"},"audio":{"device":"cpu"},"vllm":{"device":"tpu"}}}
